{
  "$schema": "https://raw.githubusercontent.com/davidsteimer/fristenrechner/main/schemas/source-review-event.schema.json",
  "formatVersion": "1.0.0",
  "dataKind": "sourceReviewEvent",
  "reviewEventId": "2026-09-22-mvp-04-prerelease.1",
  "recordStatus": "candidate",
  "recordedOn": "2026-09-22",
  "trigger": "preRelease",
  "reviewWindow": {
    "from": "2026-09-22",
    "to": "2026-09-22"
  },
  "nextAnnualReviewDue": "2027-11-15",
  "comparedReleaseIds": [
    "2026-08-31-mvp-03-approved.1",
    "2026-09-22-ap18c-candidate.1"
  ],
  "responsibility": {
    "reviewedBy": "Codex als KI-Arbeitsinstrument, fachliche Freigabe durch David Steimer ausstehend",
    "documentedWith": "Codex",
    "formalFourEyes": false,
    "operatingModel": "personalUnion"
  },
  "entries": [
    {
      "sourceId": "JUD-AP17C-BGER-8C-767-2008-20090112",
      "reviewedOn": "2026-09-22",
      "outcome": "unchanged",
      "comparisonBasis": "AP13-Ereignis 2026-08-31-initial-consolidation.1 und AP17C-Quellenabgleich vom 12.09.2026. Dieser neue Prüfentwurf ersetzt keine frühere Freigabe.",
      "evidence": {
        "method": "targetedSubstantiveComparison",
        "relevantProvisions": [
          "BGer 8C_767/2008 vom 12. Januar 2009 E. 4.3.1 und 4.3.2",
          "E. 4.3.2, ergänzend E. 4.3.1"
        ],
        "finding": "Die Nachfrist zur Behebung formeller Beschwerdemängel einschliesslich fehlender Vertretungsvollmacht wird wegen des unmittelbaren Zusammenhangs mit der Beschwerdeeinreichung dem Verweis von Art. 60 Abs. 2 ATSG auf Art. 38 bis 41 ATSG unterstellt. Grenze: Die generelle Geltung dieser Fristbestimmungen für weitere Fristen im kantonalen Rechtsmittelverfahren wird ausdrücklich offengelassen. Belegt die begrenzte Nachfristzuordnung, nicht einen allgemeinen Gerichtsstadium-Automatismus. Zugang: Amtlicher Volltext über BGer-Suchtreffer und Entscheidsuche-MCP fetch_document. Nachweis: https://search.bger.ch/ext/eurospider/live/fr/php/aza/http/index.php?azaclir=aza&from_date=&highlight_docid=aza%3A%2F%2F12-01-2009-8C_767-2008&insertion_date=&lang=fr&number_of_ranks=30&page=1&query_words=8C_767%2F2008&rank=1&sort=relevance&to_date=&top_subcollection_aza=all&type=highlight_simple_query. Gerichtstext-Spiegel ist keine amtliche Publikationsadresse."
      },
      "affected": {
        "resolutionMode": "allReferencesInRelease",
        "releaseIds": [
          "2026-09-22-ap18c-candidate.1"
        ],
        "profileIds": [],
        "calendarIds": [],
        "componentIds": []
      },
      "followUp": {
        "required": false,
        "references": []
      }
    },
    {
      "sourceId": "JUD-AP17C-VGER-BE-100-2024-8-20240404",
      "reviewedOn": "2026-09-22",
      "outcome": "unchanged",
      "comparisonBasis": "AP13-Ereignis 2026-08-31-initial-consolidation.1 und AP17C-Quellenabgleich vom 12.09.2026. Dieser neue Prüfentwurf ersetzt keine frühere Freigabe.",
      "evidence": {
        "method": "targetedSubstantiveComparison",
        "relevantProvisions": [
          "VGer BE 100.2024.8U vom 4. April 2024 E. 1.1 und 2",
          "E. 1.1, S. 4 bis 5. Ergänzend E. 2, S. 5 bis 6"
        ],
        "finding": "E. 1.1 stützt die Frist im Weiterzug an das Verwaltungsgericht auf Art. 56 Abs. 1 IVöB. E. 2 bestätigt den bernischen Beitritt per 1. Februar 2022, den beibehaltenen zweistufigen Instanzenzug und die Anwendung der neuen IVöB auf nach dem Beitritt eingeleitete Vergabeverfahren. Grenze: Der Entscheid ist kein eigenständiger Ersatz für den Normvergleich von Art. 56 IVöB. Er bestätigt die modellierte Verfahrenszuordnung und die zeitliche Abgrenzung. Zugang: Webwerkzeug, Originalentscheid als PDF im Entscheidsuche-Spiegel. Nachweis: https://entscheidsuche.ch/docs/BE_Verwaltungsgericht/BE_VG_001_100-2024-8_2024-04-04.pdf. Gerichtstext-Spiegel ist keine amtliche Publikationsadresse."
      },
      "affected": {
        "resolutionMode": "allReferencesInRelease",
        "releaseIds": [
          "2026-09-22-ap18c-candidate.1"
        ],
        "profileIds": [],
        "calendarIds": [],
        "componentIds": []
      },
      "followUp": {
        "required": false,
        "references": []
      }
    },
    {
      "sourceId": "JUD-AP17C-VGER-BE-200-2017-814-20180117",
      "reviewedOn": "2026-09-22",
      "outcome": "unchanged",
      "comparisonBasis": "AP13-Ereignis 2026-08-31-initial-consolidation.1 und AP17C-Quellenabgleich vom 12.09.2026. Dieser neue Prüfentwurf ersetzt keine frühere Freigabe.",
      "evidence": {
        "method": "targetedSubstantiveComparison",
        "relevantProvisions": [
          "VGer BE 200.2017.814 vom 17. Januar 2018 E. 1.2",
          "E. 1.2, S. 3 bis 4, insbesondere S. 4"
        ],
        "finding": "Der Entscheid beschränkt den sachlichen Anwendungsbereich von Art. 38 Abs. 4 in Verbindung mit Art. 60 Abs. 2 ATSG auf nach Tagen oder Monaten bestimmte Fristen. Für die konkret bis 18. Dezember 2017 erstreckte Replikfrist galt daher kein Fristenstillstand. Grenze: Stützt die Abgrenzung von datierten Terminen. Keine Grundlage für eine pauschale Übertragung aller ATSG-Fristregeln auf sämtliche gerichtlichen Fristen. Zugang: Entscheidsuche-MCP fetch_document, ungekürzter Volltext des PDF-Spiegels. Nachweis: https://entscheidsuche.ch/docs/BE_Verwaltungsgericht/BE_VG_001_200-2017-814_2018-01-17.pdf. Gerichtstext-Spiegel ist keine amtliche Publikationsadresse."
      },
      "affected": {
        "resolutionMode": "allReferencesInRelease",
        "releaseIds": [
          "2026-09-22-ap18c-candidate.1"
        ],
        "profileIds": [],
        "calendarIds": [],
        "componentIds": []
      },
      "followUp": {
        "required": false,
        "references": []
      }
    },
    {
      "sourceId": "JUD-BE-VG-100-2016-347",
      "reviewedOn": "2026-09-22",
      "outcome": "unchanged",
      "comparisonBasis": "AP13-Ereignis 2026-08-31-initial-consolidation.1 und AP17C-Quellenabgleich vom 12.09.2026. Dieser neue Prüfentwurf ersetzt keine frühere Freigabe.",
      "evidence": {
        "method": "targetedSubstantiveComparison",
        "relevantProvisions": [
          "VGer BE 100.2016.347U vom 29. Juni 2017 E. 3.4 und 4.5, BVR 2017 S. 459",
          "E. 3.4.1 und 3.4.2, S. 13 bis 15. Ergänzend E. 4.5, S. 19 bis 20"
        ],
        "finding": "Für Vorbereitungshandlungen ist der Ablauf der zehntägigen Beschwerdefrist im Verhältnis zum Wahl- oder Abstimmungstermin entscheidend. Bei Ablauf davor besteht selbständige Anfechtungspflicht. Bei Ablauf danach kann mit der Anfechtung des Ergebnisses zugewartet werden. E. 4.5 überträgt diese Unterscheidung auf Art. 81 Abs. 2 VRPG. Grenze: Die genaue Eröffnung oder Publikation des Vorbereitungsakts bleibt eine gesonderte Sachverhaltsfrage. Der Befund erweitert die bestehende Modellabdeckung nicht. Zugang: Webwerkzeug, Originalentscheid als PDF im Entscheidsuche-Spiegel. Nachweis: https://entscheidsuche.ch/docs/BE_Verwaltungsgericht/BE_VG_001_100-2016-347_2017-06-29.pdf. Gerichtstext-Spiegel ist keine amtliche Publikationsadresse."
      },
      "affected": {
        "resolutionMode": "allReferencesInRelease",
        "releaseIds": [
          "2026-09-22-ap18c-candidate.1"
        ],
        "profileIds": [],
        "calendarIds": [],
        "componentIds": []
      },
      "followUp": {
        "required": false,
        "references": []
      }
    },
    {
      "sourceId": "JUD-BE-VG-100-2017-270",
      "reviewedOn": "2026-09-22",
      "outcome": "unchanged",
      "comparisonBasis": "AP13-Ereignis 2026-08-31-initial-consolidation.1 und AP17C-Quellenabgleich vom 12.09.2026. Dieser neue Prüfentwurf ersetzt keine frühere Freigabe.",
      "evidence": {
        "method": "targetedSubstantiveComparison",
        "relevantProvisions": [
          "VGer BE 100.2017.270 vom 12. Dezember 2017 E. 4.1 und 4.3",
          "E. 4.1, S. 6 bis 7 und E. 4.3, S. 8 bis 9. Ergänzend E. 5.2, S. 10"
        ],
        "finding": "Der französische Entscheid bestätigt den Beginn am Folgetag der Eröffnung oder Veröffentlichung und die zehntägige Anfechtungsfrist für Vorbereitungshandlungen nach Art. 67a Abs. 2 und 3 VRPG. Bei Fristablauf vor dem Urnengang führt Untätigkeit zur Verwirkung der betreffenden Rüge gegen das Ergebnis. Grenze: E. 5.2 stellt auf den eigentlichen Abstimmungstermin und nicht auf den Beginn der brieflichen Stimmabgabe ab. Keine neue Regel nötig. Zugang: Webwerkzeug, französischer Originalentscheid als PDF im Entscheidsuche-Spiegel. Nachweis: https://entscheidsuche.ch/docs/BE_Verwaltungsgericht/BE_VG_001_100-2017-270_2017-12-12.pdf. Gerichtstext-Spiegel ist keine amtliche Publikationsadresse."
      },
      "affected": {
        "resolutionMode": "allReferencesInRelease",
        "releaseIds": [
          "2026-09-22-ap18c-candidate.1"
        ],
        "profileIds": [],
        "calendarIds": [],
        "componentIds": []
      },
      "followUp": {
        "required": false,
        "references": []
      }
    },
    {
      "sourceId": "JUD-BE-VG-100-2021-189",
      "reviewedOn": "2026-09-22",
      "outcome": "unchanged",
      "comparisonBasis": "AP13-Ereignis 2026-08-31-initial-consolidation.1 und AP17C-Quellenabgleich vom 12.09.2026. Dieser neue Prüfentwurf ersetzt keine frühere Freigabe.",
      "evidence": {
        "method": "targetedSubstantiveComparison",
        "relevantProvisions": [
          "VGer BE 100.2021.189U vom 22. Oktober 2021 E. 4.1 und 4.2, BVR 2022 S. 5",
          "E. 4.1 und 4.2, S. 18 bis 19"
        ],